{
  "schema_version": "1.4",
  "protocol_version": "2.4",
  "content_commit": "6b829798101a59fadd9a1d0efd65428539f400ad",
  "seal_created_at": "2026-07-19T02:38:32+05:30",
  "frozen_files": [
    {
      "path": "docs/feature-council/youtube-transcript-enrichment/SOURCE_INVENTORY.md",
      "sha256": "db0b9de586a0e0901545d3be6e91ef469a35d8852ee516e59d043f370a335f26"
    },
    {
      "path": "docs/feature-council/youtube-transcript-enrichment/audit/2026-07-16_focused-audit-synthesis_adversarial-review.md",
      "sha256": "bc9c2591c481f8e66789c5341e53c6ce8f803fcae88e19b258c09171c6e86b1e"
    },
    {
      "path": "docs/feature-council/youtube-transcript-enrichment/audit/2026-07-16_focused-audit-synthesis_v1.md",
      "sha256": "eeff40f5d04314de9afa35fd99e885ae2128dc5520671d5c5f2b33ccc45a83ad"
    },
    {
      "path": "docs/feature-council/youtube-transcript-enrichment/audit/2026-07-16_focused-audit-synthesis_v2.md",
      "sha256": "4feda1e9e4d4a645c93ec33023bd0b5398894ef11d2c59c6865b35170e905090"
    },
    {
      "path": "docs/feature-council/youtube-transcript-enrichment/audit/CODE_MAP.md",
      "sha256": "980ab4bceecb29eda4d5918f5060e1a61eee9175bf750fe065e9ffa3055002a3"
    },
    {
      "path": "docs/feature-council/youtube-transcript-enrichment/audit/CURRENT_PROCESSING_FLOW.md",
      "sha256": "e55c8414ebe3cd5689a4d34e46a3280d0725e3202ea7ea6ef87186f99cfbf02a"
    },
    {
      "path": "docs/feature-council/youtube-transcript-enrichment/audit/DATA_MODEL_SUMMARY.md",
      "sha256": "5c60f1855b1d6163113e8b86a33051968f08ca7eff9895ceb1515a88987daa1d"
    },
    {
      "path": "docs/feature-council/youtube-transcript-enrichment/audit/PRODUCT_FEATURE_CATALOG.md",
      "sha256": "ec4c35ea41c4bbfdbe218f34128dd21a4c165c8cfdd1611c29c7ed4c7e3a52c7"
    },
    {
      "path": "docs/feature-council/youtube-transcript-enrichment/audit/PROVIDER_INVENTORY.md",
      "sha256": "d33155ecdf43bea732570e8e857705984d2bbb609fa6886a9d22ca8cf11bf167"
    },
    {
      "path": "docs/feature-council/youtube-transcript-enrichment/audit/QA_BASELINE.md",
      "sha256": "512cacd0886c980021cd84cf123551964d3986b751fc49027cfcbb20497978b3"
    },
    {
      "path": "docs/feature-council/youtube-transcript-enrichment/audit/TRANSCRIPT_DATA_LIFECYCLE.md",
      "sha256": "9150f6576fccf6a7b242517249968b1cfd7750858a02f3c401ebd7a4532288d5"
    },
    {
      "path": "docs/feature-council/youtube-transcript-enrichment/audit/WIKI_CODE_DISCREPANCIES.md",
      "sha256": "0cf8f9da5dada13a300c9c524e5d3bf4f554525d59b7e18508cf2f4f481705a8"
    },
    {
      "path": "docs/feature-council/youtube-transcript-enrichment/benchmark/A1_ATTESTATION.schema.json",
      "sha256": "1e1e74f71c9b8c68ad90c1a8eb79285926504cc9fc384ea42035ecbf2db7367b"
    },
    {
      "path": "docs/feature-council/youtube-transcript-enrichment/benchmark/BENCHMARK_PROTOCOL.md",
      "sha256": "caef3e50983d87770fde3ade8380252f1578242938d015fd5ebde0afa080a80d"
    },
    {
      "path": "docs/feature-council/youtube-transcript-enrichment/benchmark/CORPUS_MANIFEST.md",
      "sha256": "620983fc55ca7f2d818c172de5353835b5ccb270daa8c98b128e206dd20b51c2"
    },
    {
      "path": "docs/feature-council/youtube-transcript-enrichment/benchmark/CORPUS_SOURCE_EVIDENCE.md",
      "sha256": "1543c5292c064b5dd7c3658abec5e2420c7e197a95df342fb1290cc2d3016880"
    },
    {
      "path": "docs/feature-council/youtube-transcript-enrichment/benchmark/EVALUATOR_FORM.md",
      "sha256": "129e889907b3b8d8bf04339f4646c4cc91a95b1490517ed32a8daf0d68c69579"
    },
    {
      "path": "docs/feature-council/youtube-transcript-enrichment/benchmark/LOCK.schema.json",
      "sha256": "11f7ec95eb50da8a3b2c4001922c9c345c532eb7bd0f3bacb0b2620cffb77e1c"
    },
    {
      "path": "docs/feature-council/youtube-transcript-enrichment/benchmark/METHOD_ITEM_MATRIX.json",
      "sha256": "77d07864489bc24d5246f5539418c901d263fa809c79dc7a47b903b954d3f9c0"
    },
    {
      "path": "docs/feature-council/youtube-transcript-enrichment/benchmark/METHOD_ITEM_MATRIX.md",
      "sha256": "894a0d0604d6153e2c34356c4ea4981709e6568b5a2a28edf651b3d81bcefe52"
    },
    {
      "path": "docs/feature-council/youtube-transcript-enrichment/benchmark/METHOD_ITEM_MATRIX.schema.json",
      "sha256": "09fee23d71b892c07c9fade3ec8225465caa03fde49cd50e43bdf57c6450017b"
    },
    {
      "path": "docs/feature-council/youtube-transcript-enrichment/benchmark/NORMALIZED_TRANSCRIPT.schema.json",
      "sha256": "889689c7339c4136681559463e48a33c5355468fbd411e408124c165d1a57ce1"
    },
    {
      "path": "docs/feature-council/youtube-transcript-enrichment/benchmark/PRESEAL_READINESS.json",
      "sha256": "00fcc4611dc81ce0361d45dc804178dd60b2de62337f70657627bd9dbd92bce5"
    },
    {
      "path": "docs/feature-council/youtube-transcript-enrichment/benchmark/PRESEAL_READINESS.schema.json",
      "sha256": "0d061aae73a8836d8aebaa15b73e3cff183d289e7492d9b9c06766332fb4c41f"
    },
    {
      "path": "docs/feature-council/youtube-transcript-enrichment/benchmark/REFERENCE_LEDGER.json",
      "sha256": "a8c79e27ce4eeb5ad856312b6814e85c55a7516e5538a7c54d22892a28497ea1"
    },
    {
      "path": "docs/feature-council/youtube-transcript-enrichment/benchmark/REFERENCE_LEDGER.schema.json",
      "sha256": "a976b29fe0fba93811308b85853af28a45c7284d8558e29e84265ee16cb0b66d"
    },
    {
      "path": "docs/feature-council/youtube-transcript-enrichment/benchmark/RUN_PLAN.md",
      "sha256": "665eb5f4f8fa6c94a0335f32d5e11ec2e4532c1528650cf35cf0cedc883aa739"
    },
    {
      "path": "docs/feature-council/youtube-transcript-enrichment/benchmark/SAFETY_FIXTURES.json",
      "sha256": "bd9b8ec7d7590ab4ee0459ae5ef0d6efa8c4674f534ebf116cc997c6543769ad"
    },
    {
      "path": "docs/feature-council/youtube-transcript-enrichment/benchmark/SAFETY_TEST_MATRIX.md",
      "sha256": "9c5f37831c297ec1d7be8fd80fca63572eaa2e769c29879bd0242588ba79ab39"
    },
    {
      "path": "docs/feature-council/youtube-transcript-enrichment/benchmark/attestations/README.md",
      "sha256": "f0dd4fc9c6ed2d217863de68f9e48a5f51f79732e7bba036f671ead4b549b62b"
    },
    {
      "path": "docs/feature-council/youtube-transcript-enrichment/benchmark/attestations/YT-01.json",
      "sha256": "35a1eaa09f29953e6dd44bae209c8af557fdded5ddd9ed49324d6b3c73c62432"
    },
    {
      "path": "docs/feature-council/youtube-transcript-enrichment/benchmark/attestations/YT-02.json",
      "sha256": "e5f7d74181946977ecd1091e1d995b3c37eacd4475929735ce9c0fb96bbc9b05"
    },
    {
      "path": "docs/feature-council/youtube-transcript-enrichment/benchmark/attestations/YT-03.json",
      "sha256": "89e7ed10133556a2bb78193c35b56495a024f88f95cab214334d7f105dc6087d"
    },
    {
      "path": "docs/feature-council/youtube-transcript-enrichment/benchmark/attestations/YT-04.json",
      "sha256": "cbf40747e733f2ab4fc504b211065172c0fadacf979106827306e5f26a771c8f"
    },
    {
      "path": "docs/feature-council/youtube-transcript-enrichment/benchmark/attestations/YT-05.json",
      "sha256": "c9e22b634062e87a81f55fb2f9dbbaf6e713dff369a698d1074835de17ff173a"
    },
    {
      "path": "docs/feature-council/youtube-transcript-enrichment/benchmark/attestations/YT-06.json",
      "sha256": "ca313982858721875770e36808ca3d20df33376a84166d8605689f79bd5ae2c5"
    },
    {
      "path": "docs/feature-council/youtube-transcript-enrichment/benchmark/attestations/YT-07.json",
      "sha256": "37207aef5c4db8df36418a9edda922429b9e4e042914fe7d8fca83c1adafa1e9"
    },
    {
      "path": "docs/feature-council/youtube-transcript-enrichment/benchmark/attestations/YT-08.json",
      "sha256": "f43c4da27e204036a035ecbf8c55a5d8cf6c2a7cece2454a0c5d854c658b8678"
    },
    {
      "path": "docs/feature-council/youtube-transcript-enrichment/benchmark/attestations/YT-09.json",
      "sha256": "4715cc1e53bb1d8ed0769e4a2a07a4578caae823d223f95d00cc1e47b54998b4"
    },
    {
      "path": "docs/feature-council/youtube-transcript-enrichment/benchmark/model/A1_ATTEMPT_CLAIM.schema.json",
      "sha256": "44309ab2a86a14834502d8dfdc01c88a0a7bdb103c12b4816eb81fa984631b72"
    },
    {
      "path": "docs/feature-council/youtube-transcript-enrichment/benchmark/model/A1_ATTEMPT_TERMINAL.schema.json",
      "sha256": "b8f1ed573dd090c1e80deb241b6aeca3f770d0ac3834555774c3d1df0998275a"
    },
    {
      "path": "docs/feature-council/youtube-transcript-enrichment/benchmark/model/A1_EXECUTION_CONTRACT.json",
      "sha256": "7601a0335c32c230ad13311ff88475102db52112a4f13c437742e13173a81f3e"
    },
    {
      "path": "docs/feature-council/youtube-transcript-enrichment/benchmark/model/A1_EXECUTION_CONTRACT.schema.json",
      "sha256": "79bfe4332dea8d62520e9328cc4b78cbb8c935263506f8658ec2fda322bd18e1"
    },
    {
      "path": "docs/feature-council/youtube-transcript-enrichment/benchmark/model/A1_OPERATOR_RECEIPT.schema.json",
      "sha256": "21d7c4bda4eacdda796032304924a5a663517f319b9b181465bf627951bbfc14"
    },
    {
      "path": "docs/feature-council/youtube-transcript-enrichment/benchmark/model/ADJUDICATOR_SYSTEM_PROMPT.txt",
      "sha256": "1118a1683b3f8b2c5d253f2aa0b8e0db02df6601136f2fbbf106fea8998a5ad9"
    },
    {
      "path": "docs/feature-council/youtube-transcript-enrichment/benchmark/model/BLINDED_ADJUDICATION.schema.json",
      "sha256": "470e1e606da562b6bae9771038d77b20758aa3bb3e6ee99324d628179f2f78e4"
    },
    {
      "path": "docs/feature-council/youtube-transcript-enrichment/benchmark/model/BLINDED_ADJUDICATION_GENERATION.schema.json",
      "sha256": "f0eaa99b6f689a48242b52465334a87f17a7f582d12cabbc7fcfb77ccc800396"
    },
    {
      "path": "docs/feature-council/youtube-transcript-enrichment/benchmark/model/BLINDED_ADJUDICATION_PACKET.schema.json",
      "sha256": "8f094ba42f43d107dfc52defc3ac73097f9205dfb8f5929ac95a3d11dec8bd8f"
    },
    {
      "path": "docs/feature-council/youtube-transcript-enrichment/benchmark/model/BLINDED_EVALUATION.schema.json",